{
  "schema_version": "draft-0.1",
  "id": "visio_136_опора_3",
  "name_ru": "Опора 3",
  "name_en": "",
  "category": "annotation",
  "review_status": "needs_review",
  "source": {
    "format": "vsdx",
    "master_id": "136",
    "master_name": "Опора 3",
    "master_part": "visio/masters/master134.xml",
    "page_usage": [
      "Доп.элементы"
    ],
    "text": "Ошибка Ошибка"
  },
  "viewBox": {
    "x": 0,
    "y": 0,
    "width": 1.0,
    "height": 1.0
  },
  "svg_fragment": "<path d=\"M 0 1 L 0.145669 1\" stroke=\"var(--voltage-color, currentColor)\" fill=\"none\" stroke-width=\"1.5\" stroke-linecap=\"round\" stroke-linejoin=\"round\" vector-effect=\"non-scaling-stroke\" data-geometry-section=\"1\" />\n<path d=\"M 0 1\" stroke=\"var(--voltage-color, currentColor)\" fill=\"none\" stroke-width=\"1.5\" stroke-linecap=\"round\" stroke-linejoin=\"round\" vector-effect=\"non-scaling-stroke\" data-geometry-section=\"1\" />\n<path d=\"M 0 1 L 0 1 L 0 1 L 0 1\" stroke=\"var(--voltage-color, currentColor)\" fill=\"none\" stroke-width=\"1.5\" stroke-linecap=\"round\" stroke-linejoin=\"round\" vector-effect=\"non-scaling-stroke\" data-geometry-section=\"1\" />\n<path d=\"M 0 1 L 0 1 L 0 1 L 0 1\" stroke=\"var(--voltage-color, currentColor)\" fill=\"none\" stroke-width=\"1.5\" stroke-linecap=\"round\" stroke-linejoin=\"round\" vector-effect=\"non-scaling-stroke\" data-geometry-section=\"1\" />\n<path d=\"M 0 1 L 0.15748 1\" stroke=\"var(--voltage-color, currentColor)\" fill=\"none\" stroke-width=\"1.5\" stroke-linecap=\"round\" stroke-linejoin=\"round\" vector-effect=\"non-scaling-stroke\" data-geometry-section=\"1\" />\n<path d=\"M 0 1\" stroke=\"var(--voltage-color, currentColor)\" fill=\"none\" stroke-width=\"1.5\" stroke-linecap=\"round\" stroke-linejoin=\"round\" vector-effect=\"non-scaling-stroke\" data-geometry-section=\"1\" />\n<path d=\"M 0 1 L 0 1 L 0 1 L 0 1\" stroke=\"var(--voltage-color, currentColor)\" fill=\"none\" stroke-width=\"1.5\" stroke-linecap=\"round\" stroke-linejoin=\"round\" vector-effect=\"non-scaling-stroke\" data-geometry-section=\"1\" />\n<path d=\"M 0 1 L 0 1 L 0 1 L 0 1\" stroke=\"var(--voltage-color, currentColor)\" fill=\"none\" stroke-width=\"1.5\" stroke-linecap=\"round\" stroke-linejoin=\"round\" vector-effect=\"non-scaling-stroke\" data-geometry-section=\"1\" />\n<ellipse cx=\"0.0866142\" cy=\"0.913386\" rx=\"0.0866142\" ry=\"0.15\" stroke=\"var(--voltage-color, currentColor)\" fill=\"none\" stroke-width=\"1.5\" vector-effect=\"non-scaling-stroke\" />\n<ellipse cx=\"0.0866142\" cy=\"0.913386\" rx=\"0.0866142\" ry=\"0.15\" stroke=\"var(--voltage-color, currentColor)\" fill=\"none\" stroke-width=\"1.5\" vector-effect=\"non-scaling-stroke\" />",
  "terminals": [],
  "snap_anchors": [],
  "capabilities": {
    "feature_flags": {
      "colorizable_by_voltage_class": true,
      "multi_state_candidate": false,
      "busbar_configurable_connection_points": false,
      "rotatable": true,
      "snap_anchors_required": true,
      "stretchable_leads_candidate": true,
      "auto_layout_eligible": false,
      "requires_review": true
    },
    "rotation": {
      "enabled": true,
      "allowed_degrees": [
        0,
        90,
        180,
        270
      ],
      "terminal_transform_required": true,
      "snap_anchor_transform_required": true,
      "label_rotation_policy": "keep_readable"
    },
    "stretching": {
      "enabled": true,
      "body_geometry_locked": true,
      "stretchable_parts": [
        "connection_leads",
        "busbar_length"
      ]
    },
    "snapping": {
      "enabled": true,
      "terminal_count": 0,
      "snap_to_terminals": true,
      "snap_to_busbar_generated_points": false,
      "connection_graph_node_required": true
    },
    "voltage_style": {
      "enabled": true,
      "stroke_token": "var(--voltage-color)",
      "normal_scheme_palette": "STO table 1",
      "ptk_palette": "STO table 5"
    },
    "states": {
      "enabled": false,
      "detected_tokens": [],
      "required_for_switching_device": [],
      "kru_trolley_extra_states": []
    },
    "busbar": {
      "enabled": false,
      "connection_point_count": 0,
      "connection_spacing": null,
      "length": "fixed",
      "stroke_width_multiplier": null
    }
  },
  "conversion": {
    "row_counts": {
      "MoveTo": 8,
      "LineTo": 14,
      "Ellipse": 2
    },
    "warnings": [
      "multiple Visio shapes flattened without full local transform support"
    ],
    "requires_manual_review": true,
    "known_limitations": [
      "local transforms and group transforms are not fully normalized yet",
      "advanced arcs/splines may use line fallback",
      "imported symbols are drafts only"
    ]
  }
}