{
  "schema_version": "draft-0.1",
  "id": "visio_114_счетчик_прямоточный",
  "name_ru": "Счётчик прямоточный",
  "name_en": "",
  "category": "unknown",
  "review_status": "needs_review",
  "source": {
    "format": "vsdx",
    "master_id": "114",
    "master_name": "Счётчик прямоточный",
    "master_part": "visio/masters/master112.xml",
    "page_usage": [
      "Доп.элементы"
    ],
    "text": "Wh Ошибка Ошибка"
  },
  "viewBox": {
    "x": 0,
    "y": 0,
    "width": 1.0,
    "height": 1.078740157480315
  },
  "svg_fragment": "<path d=\"M 0 1.07874 L 0.393701 1.07874 L 0.393701 0.488189 L 0 0.488189 L 0 1.07874\" stroke=\"var(--voltage-color, currentColor)\" fill=\"none\" stroke-width=\"1.5\" stroke-linecap=\"round\" stroke-linejoin=\"round\" vector-effect=\"non-scaling-stroke\" data-geometry-section=\"1\" />\n<path d=\"M 0 1.07874 L 0.393701 1.07874\" stroke=\"var(--voltage-color, currentColor)\" fill=\"none\" stroke-width=\"1.5\" stroke-linecap=\"round\" stroke-linejoin=\"round\" vector-effect=\"non-scaling-stroke\" data-geometry-section=\"1\" />\n<path d=\"M 0 1.07874 L 0.393701 1.07874 L 0.393701 0.645669 L 0 0.645669 L 0 1.07874\" stroke=\"var(--voltage-color, currentColor)\" fill=\"none\" stroke-width=\"1.5\" stroke-linecap=\"round\" stroke-linejoin=\"round\" vector-effect=\"non-scaling-stroke\" data-geometry-section=\"1\" />\n<path d=\"M 0 1.07874 L 0.241142 1.07874\" stroke=\"var(--voltage-color, currentColor)\" fill=\"none\" stroke-width=\"1.5\" stroke-linecap=\"round\" stroke-linejoin=\"round\" vector-effect=\"non-scaling-stroke\" data-geometry-section=\"1\" />\n<path d=\"M 0 1.07874\" stroke=\"var(--voltage-color, currentColor)\" fill=\"none\" stroke-width=\"1.5\" stroke-linecap=\"round\" stroke-linejoin=\"round\" vector-effect=\"non-scaling-stroke\" data-geometry-section=\"1\" />\n<path d=\"M 0 1.07874 L 0 1.07874 L 0 1.07874 L 0 1.07874\" stroke=\"var(--voltage-color, currentColor)\" fill=\"none\" stroke-width=\"1.5\" stroke-linecap=\"round\" stroke-linejoin=\"round\" vector-effect=\"non-scaling-stroke\" data-geometry-section=\"1\" />\n<path d=\"M 0 1.07874 L 0 1.07874 L 0 1.07874 L 0 1.07874\" stroke=\"var(--voltage-color, currentColor)\" fill=\"none\" stroke-width=\"1.5\" stroke-linecap=\"round\" stroke-linejoin=\"round\" vector-effect=\"non-scaling-stroke\" data-geometry-section=\"1\" />\n<path d=\"M 0 1.07874 L 0.244882 1.07874\" stroke=\"var(--voltage-color, currentColor)\" fill=\"none\" stroke-width=\"1.5\" stroke-linecap=\"round\" stroke-linejoin=\"round\" vector-effect=\"non-scaling-stroke\" data-geometry-section=\"1\" />\n<path d=\"M 0 1.07874\" stroke=\"var(--voltage-color, currentColor)\" fill=\"none\" stroke-width=\"1.5\" stroke-linecap=\"round\" stroke-linejoin=\"round\" vector-effect=\"non-scaling-stroke\" data-geometry-section=\"1\" />\n<path d=\"M 0 1.07874 L 0 1.07874 L 0 1.07874 L 0 1.07874\" stroke=\"var(--voltage-color, currentColor)\" fill=\"none\" stroke-width=\"1.5\" stroke-linecap=\"round\" stroke-linejoin=\"round\" vector-effect=\"non-scaling-stroke\" data-geometry-section=\"1\" />\n<path d=\"M 0 1.07874 L 0 1.07874 L 0 1.07874 L 0 1.07874\" stroke=\"var(--voltage-color, currentColor)\" fill=\"none\" stroke-width=\"1.5\" stroke-linecap=\"round\" stroke-linejoin=\"round\" vector-effect=\"non-scaling-stroke\" data-geometry-section=\"1\" />",
  "terminals": [],
  "snap_anchors": [],
  "capabilities": {
    "feature_flags": {
      "colorizable_by_voltage_class": true,
      "multi_state_candidate": false,
      "busbar_configurable_connection_points": false,
      "rotatable": true,
      "snap_anchors_required": true,
      "stretchable_leads_candidate": true,
      "auto_layout_eligible": true,
      "requires_review": true
    },
    "rotation": {
      "enabled": true,
      "allowed_degrees": [
        0,
        90,
        180,
        270
      ],
      "terminal_transform_required": true,
      "snap_anchor_transform_required": true,
      "label_rotation_policy": "keep_readable"
    },
    "stretching": {
      "enabled": true,
      "body_geometry_locked": true,
      "stretchable_parts": [
        "connection_leads",
        "busbar_length"
      ]
    },
    "snapping": {
      "enabled": true,
      "terminal_count": 0,
      "snap_to_terminals": true,
      "snap_to_busbar_generated_points": false,
      "connection_graph_node_required": true
    },
    "voltage_style": {
      "enabled": true,
      "stroke_token": "var(--voltage-color)",
      "normal_scheme_palette": "STO table 1",
      "ptk_palette": "STO table 5"
    },
    "states": {
      "enabled": false,
      "detected_tokens": [],
      "required_for_switching_device": [],
      "kru_trolley_extra_states": []
    },
    "busbar": {
      "enabled": false,
      "connection_point_count": 0,
      "connection_spacing": null,
      "length": "fixed",
      "stroke_width_multiplier": null
    }
  },
  "conversion": {
    "row_counts": {
      "MoveTo": 11,
      "LineTo": 23
    },
    "warnings": [
      "multiple Visio shapes flattened without full local transform support"
    ],
    "requires_manual_review": true,
    "known_limitations": [
      "local transforms and group transforms are not fully normalized yet",
      "advanced arcs/splines may use line fallback",
      "imported symbols are drafts only"
    ]
  }
}