{
  "schema_version": "draft-0.1",
  "id": "visio_65_разрядник_роговой_с_заземлением",
  "name_ru": "Разрядник роговой с заземлением",
  "name_en": "",
  "category": "earthing_switch",
  "review_status": "needs_review",
  "source": {
    "format": "vsdx",
    "master_id": "65",
    "master_name": "Разрядник роговой с заземлением",
    "master_part": "visio/masters/master63.xml",
    "page_usage": [
      "Разрядники и ОПН"
    ],
    "text": "Ошибка"
  },
  "viewBox": {
    "x": 0,
    "y": 0,
    "width": 1.0,
    "height": 1.0
  },
  "svg_fragment": "<path d=\"M 0 1 L 0.206693 1 M 0.285433 1 L 0.492126 1\" stroke=\"var(--voltage-color, currentColor)\" fill=\"none\" stroke-width=\"1.5\" stroke-linecap=\"round\" stroke-linejoin=\"round\" vector-effect=\"non-scaling-stroke\" data-geometry-section=\"1\" />\n<path d=\"M 0.147638 0.970472 L 0.206693 1\" stroke=\"var(--voltage-color, currentColor)\" fill=\"none\" stroke-width=\"1.5\" stroke-linecap=\"round\" stroke-linejoin=\"round\" vector-effect=\"non-scaling-stroke\" data-geometry-section=\"2\" />\n<path d=\"M 0.344488 0.970472 L 0.285433 1\" stroke=\"var(--voltage-color, currentColor)\" fill=\"none\" stroke-width=\"1.5\" stroke-linecap=\"round\" stroke-linejoin=\"round\" vector-effect=\"non-scaling-stroke\" data-geometry-section=\"3\" />\n<path d=\"M 0.492126 0.901575 L 0.492126 1.09843 M 0.541339 0.940945 L 0.541339 1.05906 M 0.590551 0.980315 L 0.590551 1.01969\" stroke=\"var(--voltage-color, currentColor)\" fill=\"none\" stroke-width=\"1.5\" stroke-linecap=\"round\" stroke-linejoin=\"round\" vector-effect=\"non-scaling-stroke\" data-geometry-section=\"4\" />",
  "terminals": [
    {
      "id": "1",
      "role": "terminal",
      "source": "visio_connection_point",
      "raw": {
        "x": "0",
        "y": "0",
        "formula_x": "Width*0",
        "formula_y": ""
      },
      "x": 0.0,
      "y": 1.0
    }
  ],
  "snap_anchors": [
    {
      "id": "1",
      "role": "terminal",
      "source": "visio_connection_point",
      "raw": {
        "x": "0",
        "y": "0",
        "formula_x": "Width*0",
        "formula_y": ""
      },
      "x": 0.0,
      "y": 1.0
    }
  ],
  "capabilities": {
    "feature_flags": {
      "colorizable_by_voltage_class": true,
      "multi_state_candidate": true,
      "busbar_configurable_connection_points": false,
      "rotatable": true,
      "snap_anchors_required": true,
      "stretchable_leads_candidate": true,
      "auto_layout_eligible": true,
      "requires_review": true
    },
    "rotation": {
      "enabled": true,
      "allowed_degrees": [
        0,
        90,
        180,
        270
      ],
      "terminal_transform_required": true,
      "snap_anchor_transform_required": true,
      "label_rotation_policy": "keep_readable"
    },
    "stretching": {
      "enabled": true,
      "body_geometry_locked": true,
      "stretchable_parts": [
        "connection_leads",
        "busbar_length"
      ]
    },
    "snapping": {
      "enabled": true,
      "terminal_count": 1,
      "snap_to_terminals": true,
      "snap_to_busbar_generated_points": false,
      "connection_graph_node_required": true
    },
    "voltage_style": {
      "enabled": true,
      "stroke_token": "var(--voltage-color)",
      "normal_scheme_palette": "STO table 1",
      "ptk_palette": "STO table 5"
    },
    "states": {
      "enabled": true,
      "detected_tokens": [],
      "required_for_switching_device": [
        "closed",
        "open",
        "unreliable",
        "repair"
      ],
      "kru_trolley_extra_states": []
    },
    "busbar": {
      "enabled": false,
      "connection_point_count": 0,
      "connection_spacing": null,
      "length": "fixed",
      "stroke_width_multiplier": null
    }
  },
  "conversion": {
    "row_counts": {
      "MoveTo": 7,
      "LineTo": 7
    },
    "warnings": [],
    "requires_manual_review": true,
    "known_limitations": [
      "local transforms and group transforms are not fully normalized yet",
      "advanced arcs/splines may use line fallback",
      "imported symbols are drafts only"
    ]
  }
}