{
  "schema_version": "draft-0.1",
  "id": "visio_119_перекидной_рубильник",
  "name_ru": "Перекидной рубильник",
  "name_en": "",
  "category": "unknown",
  "review_status": "needs_review",
  "source": {
    "format": "vsdx",
    "master_id": "119",
    "master_name": "Перекидной рубильник",
    "master_part": "visio/masters/master117.xml",
    "page_usage": [
      "Доп.элементы"
    ],
    "text": ""
  },
  "viewBox": {
    "x": 0,
    "y": 0,
    "width": 1.0,
    "height": 1.0
  },
  "svg_fragment": "<path d=\"M 0.0984252 1 L 0.0984252 1.3937\" stroke=\"var(--voltage-color, currentColor)\" fill=\"none\" stroke-width=\"1.5\" stroke-linecap=\"round\" stroke-linejoin=\"round\" vector-effect=\"non-scaling-stroke\" data-geometry-section=\"1\" />\n<path d=\"M 0 1 L 0.19685 1\" stroke=\"var(--voltage-color, currentColor)\" fill=\"none\" stroke-width=\"1.5\" stroke-linecap=\"round\" stroke-linejoin=\"round\" vector-effect=\"non-scaling-stroke\" data-geometry-section=\"1\" />\n<path d=\"M 0 1 L 0.19685 1\" stroke=\"var(--voltage-color, currentColor)\" fill=\"none\" stroke-width=\"1.5\" stroke-linecap=\"round\" stroke-linejoin=\"round\" vector-effect=\"non-scaling-stroke\" data-geometry-section=\"1\" />\n<path d=\"M 0.0984252 1 L 0.0984252 1.3937\" stroke=\"var(--voltage-color, currentColor)\" fill=\"none\" stroke-width=\"1.5\" stroke-linecap=\"round\" stroke-linejoin=\"round\" vector-effect=\"non-scaling-stroke\" data-geometry-section=\"1\" />\n<path d=\"M 0 1 L 0.220085 1\" stroke=\"var(--voltage-color, currentColor)\" fill=\"none\" stroke-width=\"1.5\" stroke-linecap=\"round\" stroke-linejoin=\"round\" vector-effect=\"non-scaling-stroke\" data-geometry-section=\"1\" />\n<path d=\"M 0.0984252 1 L 0.0984252 0.704724\" stroke=\"var(--voltage-color, currentColor)\" fill=\"none\" stroke-width=\"1.5\" stroke-linecap=\"round\" stroke-linejoin=\"round\" vector-effect=\"non-scaling-stroke\" data-geometry-section=\"1\" />",
  "terminals": [
    {
      "id": "t1",
      "role": "terminal",
      "source": "visio_connection_point",
      "raw": {
        "x": "0.688976377952756",
        "y": "0.8858267716535444",
        "formula_x": "Width*0.875",
        "formula_y": "Height*1"
      },
      "x": 0.688976377952756,
      "y": 0.1141732283464556
    },
    {
      "id": "t2",
      "role": "terminal",
      "source": "visio_connection_point",
      "raw": {
        "x": "0.09842519685039376",
        "y": "0.8858267716535444",
        "formula_x": "Width*0.125",
        "formula_y": "Height*1"
      },
      "x": 0.09842519685039376,
      "y": 0.1141732283464556
    },
    {
      "id": "t3",
      "role": "terminal",
      "source": "visio_connection_point",
      "raw": {
        "x": "0.3937007874015751",
        "y": "0.003937007874018406",
        "formula_x": "Width*0.5",
        "formula_y": "Height*0.0044444444444474"
      },
      "x": 0.3937007874015751,
      "y": 0.9960629921259816
    }
  ],
  "snap_anchors": [
    {
      "id": "t1",
      "role": "terminal",
      "source": "visio_connection_point",
      "raw": {
        "x": "0.688976377952756",
        "y": "0.8858267716535444",
        "formula_x": "Width*0.875",
        "formula_y": "Height*1"
      },
      "x": 0.688976377952756,
      "y": 0.1141732283464556
    },
    {
      "id": "t2",
      "role": "terminal",
      "source": "visio_connection_point",
      "raw": {
        "x": "0.09842519685039376",
        "y": "0.8858267716535444",
        "formula_x": "Width*0.125",
        "formula_y": "Height*1"
      },
      "x": 0.09842519685039376,
      "y": 0.1141732283464556
    },
    {
      "id": "t3",
      "role": "terminal",
      "source": "visio_connection_point",
      "raw": {
        "x": "0.3937007874015751",
        "y": "0.003937007874018406",
        "formula_x": "Width*0.5",
        "formula_y": "Height*0.0044444444444474"
      },
      "x": 0.3937007874015751,
      "y": 0.9960629921259816
    }
  ],
  "capabilities": {
    "feature_flags": {
      "colorizable_by_voltage_class": true,
      "multi_state_candidate": false,
      "busbar_configurable_connection_points": false,
      "rotatable": true,
      "snap_anchors_required": true,
      "stretchable_leads_candidate": true,
      "auto_layout_eligible": true,
      "requires_review": true
    },
    "rotation": {
      "enabled": true,
      "allowed_degrees": [
        0,
        90,
        180,
        270
      ],
      "terminal_transform_required": true,
      "snap_anchor_transform_required": true,
      "label_rotation_policy": "keep_readable"
    },
    "stretching": {
      "enabled": true,
      "body_geometry_locked": true,
      "stretchable_parts": [
        "connection_leads",
        "busbar_length"
      ]
    },
    "snapping": {
      "enabled": true,
      "terminal_count": 3,
      "snap_to_terminals": true,
      "snap_to_busbar_generated_points": false,
      "connection_graph_node_required": true
    },
    "voltage_style": {
      "enabled": true,
      "stroke_token": "var(--voltage-color)",
      "normal_scheme_palette": "STO table 1",
      "ptk_palette": "STO table 5"
    },
    "states": {
      "enabled": false,
      "detected_tokens": [],
      "required_for_switching_device": [],
      "kru_trolley_extra_states": []
    },
    "busbar": {
      "enabled": false,
      "connection_point_count": 0,
      "connection_spacing": null,
      "length": "fixed",
      "stroke_width_multiplier": null
    }
  },
  "conversion": {
    "row_counts": {
      "MoveTo": 6,
      "LineTo": 6
    },
    "warnings": [
      "multiple Visio shapes flattened without full local transform support"
    ],
    "requires_manual_review": true,
    "known_limitations": [
      "local transforms and group transforms are not fully normalized yet",
      "advanced arcs/splines may use line fallback",
      "imported symbols are drafts only"
    ]
  }
}