{
  "schema_version": "draft-0.1",
  "id": "visio_2_генератор",
  "name_ru": "Генератор",
  "name_en": "",
  "category": "transformer",
  "review_status": "needs_review",
  "source": {
    "format": "vsdx",
    "master_id": "2",
    "master_name": "Генератор",
    "master_part": "visio/masters/master1.xml",
    "page_usage": [
      "Генераторы, двигатели"
    ],
    "text": "Ошибка"
  },
  "viewBox": {
    "x": 0,
    "y": 0,
    "width": 1.0,
    "height": 1.0
  },
  "svg_fragment": "<path d=\"M 0.590551 1 L 0.492126 1\" stroke=\"var(--voltage-color, currentColor)\" fill=\"none\" stroke-width=\"1.5\" stroke-linecap=\"round\" stroke-linejoin=\"round\" vector-effect=\"non-scaling-stroke\" data-geometry-section=\"1\" />\n<ellipse cx=\"0.246063\" cy=\"0.753937\" rx=\"0.246063\" ry=\"0.15\" stroke=\"var(--voltage-color, currentColor)\" fill=\"none\" stroke-width=\"1.5\" vector-effect=\"non-scaling-stroke\" />\n<path d=\"M 0.246063 0.950787 L 0.123031 0.950787 L 0 0.950787\" stroke=\"var(--voltage-color, currentColor)\" fill=\"none\" stroke-width=\"1.5\" stroke-linecap=\"round\" stroke-linejoin=\"round\" vector-effect=\"non-scaling-stroke\" data-geometry-section=\"1\" />",
  "terminals": [
    {
      "id": "2",
      "role": "terminal",
      "source": "visio_connection_point",
      "raw": {
        "x": "0.5905511811023629",
        "y": "0",
        "formula_x": "Width*1",
        "formula_y": ""
      },
      "x": 0.5905511811023629,
      "y": 1.0
    }
  ],
  "snap_anchors": [
    {
      "id": "2",
      "role": "terminal",
      "source": "visio_connection_point",
      "raw": {
        "x": "0.5905511811023629",
        "y": "0",
        "formula_x": "Width*1",
        "formula_y": ""
      },
      "x": 0.5905511811023629,
      "y": 1.0
    }
  ],
  "capabilities": {
    "feature_flags": {
      "colorizable_by_voltage_class": true,
      "multi_state_candidate": false,
      "busbar_configurable_connection_points": false,
      "rotatable": true,
      "snap_anchors_required": true,
      "stretchable_leads_candidate": false,
      "auto_layout_eligible": true,
      "requires_review": true
    },
    "rotation": {
      "enabled": true,
      "allowed_degrees": [
        0,
        90,
        180,
        270
      ],
      "terminal_transform_required": true,
      "snap_anchor_transform_required": true,
      "label_rotation_policy": "keep_readable"
    },
    "stretching": {
      "enabled": false,
      "body_geometry_locked": true,
      "stretchable_parts": []
    },
    "snapping": {
      "enabled": true,
      "terminal_count": 1,
      "snap_to_terminals": true,
      "snap_to_busbar_generated_points": false,
      "connection_graph_node_required": true
    },
    "voltage_style": {
      "enabled": true,
      "stroke_token": "var(--voltage-color)",
      "normal_scheme_palette": "STO table 1",
      "ptk_palette": "STO table 5"
    },
    "states": {
      "enabled": false,
      "detected_tokens": [],
      "required_for_switching_device": [],
      "kru_trolley_extra_states": []
    },
    "busbar": {
      "enabled": false,
      "connection_point_count": 0,
      "connection_spacing": null,
      "length": "fixed",
      "stroke_width_multiplier": null
    }
  },
  "conversion": {
    "row_counts": {
      "MoveTo": 2,
      "LineTo": 1,
      "Ellipse": 1,
      "EllipticalArcTo": 2
    },
    "warnings": [
      "EllipticalArcTo converted as line fallback",
      "multiple Visio shapes flattened without full local transform support"
    ],
    "requires_manual_review": true,
    "known_limitations": [
      "local transforms and group transforms are not fully normalized yet",
      "advanced arcs/splines may use line fallback",
      "imported symbols are drafts only"
    ]
  }
}